company,contact,email,title,industry,employees,revenue,location,website,phone,notes
Northstar Analytics,Maya Chen,maya@northstaranalytics.example,Founder,B2B Software,42,4200000,Austin TX,northstaranalytics.example,+1-555-0101,Hiring implementation staff and expanding into healthcare analytics.
HarborGrid Services,Jon Bell,jon@harborgrid.example,Owner,Industrial Services,88,9700000,Denver CO,harborgrid.example,+1-555-0102,Founder-led field services business with recurring maintenance contracts.
AtlasBridge Logistics,Omar Ruiz,omar@atlasbridge.example,President,Logistics,135,18500000,Phoenix AZ,atlasbridge.example,+1-555-0103,Opened a new warehouse and has manual dispatch workflows suitable for automation.
Lumen Family Dental,Evelyn Ross,evelyn@lumendental.example,Managing Partner,Healthcare Services,24,3100000,Chicago IL,lumendental.example,+1-555-0104,Multi-location dental practice with stable local demand and owner contact available.
Fable Finch Studio,Rina Patel,rina@fablefinch.example,Founder,Creative Agency,18,1400000,Portland OR,fablefinch.example,+1-555-0105,Small services business with project-based revenue and limited recurring contracts.
